"No.","Time","Source","Destination","Protocol","Length","Info"
"1","0.000000","10.0.5.220","10.0.5.86","TCP","74","38900  >  9999 [SYN] Seq=0 Win=65535 Len=0 MSS=1460 SACK_PERM TSval=48529880 TSecr=0 WS=256"
"2","0.000121","10.0.5.220","52.4.140.83","TLSv1.2","97","Encrypted Alert"
"3","0.015880","10.0.5.220","52.4.140.83","TCP","66","40106  >  443 [FIN, ACK] Seq=32 Ack=1 Win=388 Len=0 TSval=48529882 TSecr=2093386696"
"4","0.016038","10.0.5.220","52.4.140.83","TCP","74","40142  >  443 [SYN] Seq=0 Win=65535 Len=0 MSS=1460 SACK_PERM TSval=48529882 TSecr=0 WS=256"
"5","0.026982","52.4.140.83","10.0.5.220","TCP","54","443  >  40106 [RST] Seq=1 Win=0 Len=0"
"6","0.041850","52.4.140.83","10.0.5.220","TCP","74","443  >  40142 [SYN, ACK] Seq=0 Ack=1 Win=26847 Len=0 MSS=1460 SACK_PERM TSval=2094977130 TSecr=48529882 WS=256"
"7","0.119180","10.0.5.220","52.4.140.83","TCP","66","[TCP Retransmission] 40106  >  443 [FIN, ACK] Seq=32 Ack=1 Win=388 Len=0 TSval=48529916 TSecr=2093386696"
"8","0.146270","10.0.5.220","52.4.140.83","TCP","66","40142  >  443 [ACK] Seq=1 Ack=1 Win=87808 Len=0 TSval=48529928 TSecr=2094977130"
"9","0.147917","10.0.5.220","52.4.140.83","TLSv1.2","583","Client Hello (SNI=n-wap.tplinkcloud.com)"
"10","0.173698","52.4.140.83","10.0.5.220","TCP","66","443  >  40142 [ACK] Seq=1 Ack=518 Win=28160 Len=0 TSval=2094977262 TSecr=48529928"
"11","0.174511","52.4.140.83","10.0.5.220","TLSv1.2","1514","Server Hello"
"12","0.174529","52.4.140.83","10.0.5.220","TCP","1514","443  >  40142 [ACK] Seq=1449 Ack=518 Win=28160 Len=1448 TSval=2094977263 TSecr=48529928 [TCP PDU reassembled in 13]"
"13","0.174538","52.4.140.83","10.0.5.220","TLSv1.2","593","Certificate, Server Key Exchange, Server Hello Done"
"14","0.361761","10.0.5.220","52.4.140.83","TCP","66","40142  >  443 [ACK] Seq=518 Ack=1449 Win=90624 Len=0 TSval=48529990 TSecr=2094977263"
"15","0.408495","10.0.5.220","52.4.140.83","TCP","78","[TCP Dup ACK 14#1] 40142  >  443 [ACK] Seq=518 Ack=1449 Win=93440 Len=0 TSval=48529992 TSecr=2094977263 SLE=2897 SRE=3424"
"16","0.480644","52.4.140.83","10.0.5.220","TCP","1514","[TCP Retransmission] 443  >  40142 [ACK] Seq=1449 Ack=518 Win=28160 Len=1448 TSval=2094977569 TSecr=48529992 [TCP PDU reassembled in 13]"
"17","0.576742","10.0.5.220","52.4.140.83","TCP","66","40142  >  443 [ACK] Seq=518 Ack=3424 Win=96512 Len=0 TSval=48530050 TSecr=2094977569"
"18","0.580243","10.0.5.220","52.4.140.83","TLSv1.2","192","Client Key Exchange, Change Cipher Spec, Encrypted Handshake Message"
"19","0.608451","52.4.140.83","10.0.5.220","TLSv1.2","117","Change Cipher Spec, Encrypted Handshake Message"
"20","0.615829","10.0.5.220","52.4.140.83","TLSv1.2","869","Application Data"
"21","0.643786","52.4.140.83","10.0.5.220","TLSv1.2","281","Application Data"
"22","0.716299","10.0.5.220","52.4.140.83","TCP","66","40142  >  443 [ACK] Seq=1447 Ack=3690 Win=99328 Len=0 TSval=48530099 TSecr=2094977733"
"23","0.907072","10.0.5.220","44.209.20.155","TLSv1.2","97","Encrypted Alert"
"24","0.907258","10.0.5.220","44.209.20.155","TCP","66","45299  >  443 [RST, ACK] Seq=32 Ack=1 Win=444 Len=0 TSval=48530153 TSecr=2075463947"
"25","0.993272","10.0.5.220","10.0.5.86","TCP","74","[TCP Retransmission] 38900  >  9999 [SYN] Seq=0 Win=65535 Len=0 MSS=1460 SACK_PERM TSval=48530182 TSecr=0 WS=256"
"26","0.993778","10.0.5.220","44.209.20.155","TLSv1.2","97","Encrypted Alert"
"27","0.994289","10.0.5.220","44.209.20.155","TCP","66","45295  >  443 [RST, ACK] Seq=32 Ack=1 Win=524 Len=0 TSval=48530182 TSecr=2075464059"
"28","1.989047","10.0.5.220","52.72.179.74","TLSv1.2","591","Application Data"
"29","1.989352","10.0.5.220","3.93.209.69","TLSv1.2","589","Application Data"
"30","1.989436","10.0.5.220","3.93.209.69","TLSv1.2","97","Encrypted Alert"
"31","1.989732","10.0.5.220","3.93.209.69","TLSv1.2","589","Application Data"
"32","1.989813","10.0.5.220","52.72.179.74","TLSv1.2","97","Encrypted Alert"
"33","1.989982","10.0.5.220","3.93.209.69","TLSv1.2","97","Encrypted Alert"
"34","1.990486","10.0.5.220","3.93.209.69","TLSv1.2","591","Application Data"
"35","1.990568","10.0.5.220","52.72.179.74","TLSv1.2","589","Application Data"
"36","1.990668","10.0.5.220","255.255.255.255","UDP","543","44318  >  20002 Len=501"
"37","1.990741","10.0.5.220","255.255.255.255","TPLINK-SMARTHOME/JSON","189","UDP Cmd: {""system"":{""get_sysinfo"":{}},""cnCloud"":{""get_info"":{}},""smartlife.iot.common.cloud"":{""get_info"":{}},""smartlife.cam.ipcamera.cloud"":{""get_info"":{}}}"
"38","1.990778","10.0.5.220","52.4.140.83","TLSv1.2","97","Encrypted Alert"
"39","1.990849","10.0.5.220","52.4.140.83","TCP","66","39974  >  443 [FIN, ACK] Seq=32 Ack=1 Win=422 Len=0 TSval=48530479 TSecr=2092879698"
"40","1.991104","10.0.5.220","10.0.5.1","DNS","95","Standard query 0x83a8 A use1-app-server.iot.i.tplinknbu.com"
"41","1.991167","10.0.5.220","3.93.209.69","TLSv1.2","97","Encrypted Alert"
"42","1.991226","10.0.5.220","52.4.140.83","TCP","74","40144  >  443 [SYN] Seq=0 Win=65535 Len=0 MSS=1460 SACK_PERM TSval=48530480 TSecr=0 WS=256"
"43","1.994485","10.0.5.1","10.0.5.220","DNS","143","Standard query response 0x83a8 A use1-app-server.iot.i.tplinknbu.com A 52.72.179.74 A 3.93.209.69 A 52.54.238.225"
"44","2.000777","10.0.5.220","52.72.179.74","TLSv1.2","97","Encrypted Alert"
"45","2.001026","10.0.5.220","10.0.5.1","DNS","76","Standard query 0x1a60 A api.tplinkra.com"
"46","2.001080","10.0.5.220","52.72.179.74","TCP","74","43360  >  443 [SYN] Seq=0 Win=65535 Len=0 MSS=1460 SACK_PERM TSval=48530480 TSecr=0 WS=256"
"47","2.001326","10.0.5.220","3.93.209.69","TCP","74","39195  >  443 [SYN] Seq=0 Win=65535 Len=0 MSS=1460 SACK_PERM TSval=48530480 TSecr=0 WS=256"
"48","2.001406","10.0.5.220","10.0.5.1","DNS","95","Standard query 0xb895 A use1-app-server.iot.i.tplinknbu.com"
"49","2.001560","10.0.5.220","10.0.5.1","DNS","76","Standard query 0xe0ee A api.tplinkra.com"
"50","2.001643","10.0.5.220","224.0.0.251","MDNS","46","Server status request 0x0aba[Malformed Packet]"
"51","2.002187","10.0.5.1","10.0.5.220","DNS","143","Standard query response 0xb895 A use1-app-server.iot.i.tplinknbu.com A 52.54.238.225 A 3.93.209.69 A 52.72.179.74"
"52","2.004110","10.0.5.220","52.72.179.74","TCP","74","43364  >  443 [SYN] Seq=0 Win=65535 Len=0 MSS=1460 SACK_PERM TSval=48530484 TSecr=0 WS=256"
"53","2.005055","10.0.5.1","10.0.5.220","DNS","204","Standard query response 0x1a60 A api.tplinkra.com A 18.211.43.252 A 54.237.32.160 A 18.235.153.180 A 52.3.148.9 A 34.206.103.1 A 3.209.101.212 A 52.204.53.53 A 54.160.47.161"
"54","2.005196","10.0.5.1","10.0.5.220","DNS","204","Standard query response 0xe0ee A api.tplinkra.com A 18.211.43.252 A 54.237.32.160 A 18.235.153.180 A 52.3.148.9 A 34.206.103.1 A 3.209.101.212 A 52.204.53.53 A 54.160.47.161"
"55","2.012957","3.93.209.69","10.0.5.220","TCP","54","443  >  38993 [RST] Seq=1 Win=0 Len=0"
"56","2.014330","3.93.209.69","10.0.5.220","TCP","54","443  >  38987 [RST] Seq=1 Win=0 Len=0"
"57","2.014799","3.93.209.69","10.0.5.220","TCP","54","443  >  38995 [RST] Seq=1 Win=0 Len=0"
"58","2.015608","52.72.179.74","10.0.5.220","TCP","54","443  >  43148 [RST] Seq=1 Win=0 Len=0"
"59","2.016592","52.72.179.74","10.0.5.220","TCP","54","443  >  43192 [RST] Seq=1 Win=0 Len=0"
"60","2.016900","52.4.140.83","10.0.5.220","TCP","54","443  >  39974 [RST] Seq=1 Win=0 Len=0"
"61","2.018255","52.4.140.83","10.0.5.220","TCP","74","443  >  40144 [SYN, ACK] Seq=0 Ack=1 Win=26847 Len=0 MSS=1460 SACK_PERM TSval=2094979107 TSecr=48530480 WS=256"
"62","2.025088","3.93.209.69","10.0.5.220","TCP","74","443  >  39195 [SYN, ACK] Seq=0 Ack=1 Win=26847 Len=0 MSS=1460 SACK_PERM TSval=3892433582 TSecr=48530480 WS=256"
"63","2.027055","52.72.179.74","10.0.5.220","TCP","74","443  >  43360 [SYN, ACK] Seq=0 Ack=1 Win=26847 Len=0 MSS=1460 SACK_PERM TSval=2718994153 TSecr=48530480 WS=256"
"64","2.029923","52.72.179.74","10.0.5.220","TCP","74","443  >  43364 [SYN, ACK] Seq=0 Ack=1 Win=26847 Len=0 MSS=1460 SACK_PERM TSval=2718994131 TSecr=48530484 WS=256"
"65","2.031822","10.0.5.220","52.4.140.83","TCP","66","40144  >  443 [ACK] Seq=1 Ack=1 Win=87808 Len=0 TSval=48530493 TSecr=2094979107"
"66","2.033317","10.0.5.220","3.93.209.69","TCP","66","39195  >  443 [ACK] Seq=1 Ack=1 Win=87808 Len=0 TSval=48530493 TSecr=3892433582"
"67","2.033467","10.0.5.220","52.72.179.74","TCP","66","43360  >  443 [ACK] Seq=1 Ack=1 Win=87808 Len=0 TSval=48530493 TSecr=2718994153"
"68","2.033614","10.0.5.220","52.72.179.74","TCP","66","43364  >  443 [ACK] Seq=1 Ack=1 Win=87808 Len=0 TSval=48530493 TSecr=2718994131"
"69","2.033761","10.0.5.220","3.93.209.69","TCP","74","39199  >  443 [SYN] Seq=0 Win=65535 Len=0 MSS=1460 SACK_PERM TSval=48530494 TSecr=0 WS=256"
"70","2.034159","10.0.5.220","52.72.179.74","TLSv1.2","583","Client Hello (SNI=use1-app-server.iot.i.tplinknbu.com)"
"71","2.035586","10.0.5.220","52.4.140.83","TLSv1.2","583","Client Hello (SNI=n-use1-wap.tplinkcloud.com)"
"72","2.035753","10.0.5.220","18.211.43.252","TCP","74","46042  >  443 [SYN] Seq=0 Win=65535 Len=0 MSS=1460 SACK_PERM TSval=48530494 TSecr=0 WS=256"
"73","2.035920","10.0.5.220","18.211.43.252","TCP","74","46043  >  443 [SYN] Seq=0 Win=65535 Len=0 MSS=1460 SACK_PERM TSval=48530494 TSecr=0 WS=256"
"74","2.038905","10.0.5.220","3.93.209.69","TLSv1.2","583","Client Hello (SNI=use1-app-server.iot.i.tplinknbu.com)"
"75","2.038969","10.0.5.220","52.72.179.74","TLSv1.2","583","Client Hello (SNI=use1-app-server.iot.i.tplinknbu.com)"
"76","2.059690","3.93.209.69","10.0.5.220","TCP","74","443  >  39199 [SYN, ACK] Seq=0 Ack=1 Win=26847 Len=0 MSS=1460 SACK_PERM TSval=3892433579 TSecr=48530494 WS=256"
"77","2.059902","52.72.179.74","10.0.5.220","TCP","66","443  >  43364 [ACK] Seq=1 Ack=518 Win=30464 Len=0 TSval=2718994186 TSecr=48530494"
"78","2.061055","18.211.43.252","10.0.5.220","TCP","74","443  >  46042 [SYN, ACK] Seq=0 Ack=1 Win=26847 Len=0 MSS=1460 SACK_PERM TSval=3340279947 TSecr=48530494 WS=256"
"79","2.061107","52.72.179.74","10.0.5.220","TLSv1.2","1514","Server Hello"
"80","2.061117","52.72.179.74","10.0.5.220","TCP","1514","443  >  43364 [ACK] Seq=1449 Ack=518 Win=30464 Len=1448 TSval=2718994187 TSecr=48530494 [TCP PDU reassembled in 81]"
"81","2.061125","52.72.179.74","10.0.5.220","TLSv1.2","735","Certificate, Server Key Exchange, Server Hello Done"
"82","2.061523","52.4.140.83","10.0.5.220","TCP","66","443  >  40144 [ACK] Seq=1 Ack=518 Win=28160 Len=0 TSval=2094979150 TSecr=48530494"
"83","2.061847","18.211.43.252","10.0.5.220","TCP","74","443  >  46043 [SYN, ACK] Seq=0 Ack=1 Win=26847 Len=0 MSS=1460 SACK_PERM TSval=3340279948 TSecr=48530494 WS=256"
"84","2.062091","3.93.209.69","10.0.5.220","TCP","66","443  >  39195 [ACK] Seq=1 Ack=518 Win=28160 Len=0 TSval=3892433620 TSecr=48530494"
"85","2.062591","52.4.140.83","10.0.5.220","TLSv1.2","1514","Server Hello"
"86","2.062608","52.4.140.83","10.0.5.220","TCP","1514","443  >  40144 [ACK] Seq=1449 Ack=518 Win=28160 Len=1448 TSval=2094979151 TSecr=48530494 [TCP PDU reassembled in 87]"
"87","2.062617","52.4.140.83","10.0.5.220","TLSv1.2","593","Certificate, Server Key Exchange, Server Hello Done"
"88","2.063102","3.93.209.69","10.0.5.220","TLSv1.2","1514","Server Hello"
"89","2.063121","3.93.209.69","10.0.5.220","TCP","1514","443  >  39195 [ACK] Seq=1449 Ack=518 Win=28160 Len=1448 TSval=3892433620 TSecr=48530494 [TCP PDU reassembled in 90]"
"90","2.063130","3.93.209.69","10.0.5.220","TLSv1.2","735","Certificate, Server Key Exchange, Server Hello Done"
"91","2.064653","52.72.179.74","10.0.5.220","TCP","66","443  >  43360 [ACK] Seq=1 Ack=518 Win=28160 Len=0 TSval=2718994191 TSecr=48530494"
"92","2.065602","52.72.179.74","10.0.5.220","TLSv1.2","1514","Server Hello"
"93","2.065621","52.72.179.74","10.0.5.220","TCP","1514","443  >  43360 [ACK] Seq=1449 Ack=518 Win=28160 Len=1448 TSval=2718994192 TSecr=48530494 [TCP PDU reassembled in 94]"
"94","2.065630","52.72.179.74","10.0.5.220","TLSv1.2","735","Certificate, Server Key Exchange, Server Hello Done"
"95","2.087577","10.0.5.220","3.93.209.69","TCP","66","39199  >  443 [ACK] Seq=1 Ack=1 Win=87808 Len=0 TSval=48530504 TSecr=3892433579"
"96","2.089539","10.0.5.220","18.211.43.252","TCP","66","46042  >  443 [ACK] Seq=1 Ack=1 Win=87808 Len=0 TSval=48530504 TSecr=3340279947"
"97","2.089606","10.0.5.220","52.72.179.74","TCP","66","43364  >  443 [ACK] Seq=518 Ack=1449 Win=90624 Len=0 TSval=48530504 TSecr=2718994187"
"98","2.089687","10.0.5.220","52.72.179.74","TCP","66","43364  >  443 [ACK] Seq=518 Ack=2897 Win=93440 Len=0 TSval=48530504 TSecr=2718994187"
"99","2.089770","10.0.5.220","52.72.179.74","TCP","66","43364  >  443 [ACK] Seq=518 Ack=3566 Win=96512 Len=0 TSval=48530504 TSecr=2718994187"
"100","2.089868","10.0.5.220","18.211.43.252","TCP","66","46043  >  443 [ACK] Seq=1 Ack=1 Win=87808 Len=0 TSval=48530504 TSecr=3340279948"
"101","2.089871","10.0.5.220","52.4.140.83","TCP","66","40144  >  443 [ACK] Seq=518 Ack=1449 Win=90624 Len=0 TSval=48530504 TSecr=2094979151"
"102","2.089874","10.0.5.220","3.93.209.69","TLSv1.2","583","Client Hello (SNI=use1-app-server.iot.i.tplinknbu.com)"
"103","2.089877","10.0.5.220","18.211.43.252","TLSv1.2","583","Client Hello (SNI=api.tplinkra.com)"
"104","2.115601","3.93.209.69","10.0.5.220","TCP","66","443  >  39199 [ACK] Seq=1 Ack=518 Win=30464 Len=0 TSval=3892433673 TSecr=48530504"
"105","2.116418","3.93.209.69","10.0.5.220","TLSv1.2","1514","Server Hello"
"106","2.116433","3.93.209.69","10.0.5.220","TCP","1514","443  >  39199 [ACK] Seq=1449 Ack=518 Win=30464 Len=1448 TSval=3892433674 TSecr=48530504 [TCP PDU reassembled in 107]"
"107","2.116441","3.93.209.69","10.0.5.220","TLSv1.2","735","Certificate, Server Key Exchange, Server Hello Done"
"108","2.116454","18.211.43.252","10.0.5.220","TCP","66","443  >  46043 [ACK] Seq=1 Ack=518 Win=28160 Len=0 TSval=3340280003 TSecr=48530504"
"109","2.116733","18.211.43.252","10.0.5.220","TLSv1.2","1514","Server Hello"
"110","2.116747","18.211.43.252","10.0.5.220","TCP","1514","443  >  46043 [ACK] Seq=1449 Ack=518 Win=28160 Len=1448 TSval=3340280003 TSecr=48530504 [TCP PDU reassembled in 112]"
"111","2.116755","18.211.43.252","10.0.5.220","TCP","1514","443  >  46043 [ACK] Seq=2897 Ack=518 Win=28160 Len=1448 TSval=3340280003 TSecr=48530504 [TCP PDU reassembled in 112]"
"112","2.117454","18.211.43.252","10.0.5.220","TLSv1.2","1311","Certificate, Server Key Exchange, Server Hello Done"
"113","2.136788","3.93.209.69","10.0.5.220","TCP","735","[TCP Retransmission] 443  >  39195 [PSH, ACK] Seq=2897 Ack=518 Win=28160 Len=669 TSval=3892433694 TSecr=48530494"
"114","2.139809","52.72.179.74","10.0.5.220","TCP","735","[TCP Retransmission] 443  >  43360 [PSH, ACK] Seq=2897 Ack=518 Win=28160 Len=669 TSval=2718994266 TSecr=48530494"
"115","2.208500","52.4.140.83","10.0.5.220","TCP","593","[TCP Retransmission] 443  >  40144 [PSH, ACK] Seq=2897 Ack=518 Win=28160 Len=527 TSval=2094979297 TSecr=48530504"
"116","2.238197","10.0.5.220","18.211.43.252","TLSv1.2","583","Client Hello (SNI=api.tplinkra.com)"
"117","2.238554","10.0.5.220","52.72.179.74","TLSv1.2","192","Client Key Exchange, Change Cipher Spec, Encrypted Handshake Message"
"118","2.238617","10.0.5.220","52.4.140.83","TCP","66","40144  >  443 [ACK] Seq=518 Ack=2897 Win=93440 Len=0 TSval=48530508 TSecr=2094979151"
"119","2.238698","10.0.5.220","52.4.140.83","TCP","66","40144  >  443 [ACK] Seq=518 Ack=3424 Win=96512 Len=0 TSval=48530508 TSecr=2094979151"
"120","2.238776","10.0.5.220","3.93.209.69","TCP","66","39195  >  443 [ACK] Seq=518 Ack=1449 Win=90624 Len=0 TSval=48530508 TSecr=3892433620"
"121","2.238854","10.0.5.220","3.93.209.69","TCP","66","39195  >  443 [ACK] Seq=518 Ack=2897 Win=93440 Len=0 TSval=48530508 TSecr=3892433620"
"122","2.238930","10.0.5.220","3.93.209.69","TCP","66","39195  >  443 [ACK] Seq=518 Ack=3566 Win=96512 Len=0 TSval=48530508 TSecr=3892433620"
"123","2.239006","10.0.5.220","52.72.179.74","TCP","66","43360  >  443 [ACK] Seq=518 Ack=1449 Win=90624 Len=0 TSval=48530509 TSecr=2718994192"
"124","2.239082","10.0.5.220","52.72.179.74","TCP","66","43360  >  443 [ACK] Seq=518 Ack=2897 Win=93440 Len=0 TSval=48530509 TSecr=2718994192"
"125","2.239158","10.0.5.220","52.72.179.74","TCP","66","43360  >  443 [ACK] Seq=518 Ack=3566 Win=96512 Len=0 TSval=48530509 TSecr=2718994192"
"126","2.239233","10.0.5.220","52.4.140.83","TLSv1.2","192","Client Key Exchange, Change Cipher Spec, Encrypted Handshake Message"
"127","2.243213","10.0.5.220","52.72.179.74","TLSv1.2","192","Client Key Exchange, Change Cipher Spec, Encrypted Handshake Message"
"128","2.244739","18.211.43.252","10.0.5.220","TCP","1311","[TCP Retransmission] 443  >  46043 [PSH, ACK] Seq=4345 Ack=518 Win=28160 Len=1245 TSval=3340280131 TSecr=48530504"
"129","2.246237","10.0.5.220","3.93.209.69","TLSv1.2","192","Client Key Exchange, Change Cipher Spec, Encrypted Handshake Message"
"130","2.263880","18.211.43.252","10.0.5.220","TCP","66","443  >  46042 [ACK] Seq=1 Ack=518 Win=28160 Len=0 TSval=3340280150 TSecr=48530504"
"131","2.263906","52.72.179.74","10.0.5.220","TLSv1.2","117","Change Cipher Spec, Encrypted Handshake Message"
"132","2.263944","18.211.43.252","10.0.5.220","TLSv1.2","1514","Server Hello"
"133","2.263953","18.211.43.252","10.0.5.220","TCP","1514","443  >  46042 [ACK] Seq=1449 Ack=518 Win=28160 Len=1448 TSval=3340280150 TSecr=48530504 [TCP PDU reassembled in 135]"
"134","2.263961","18.211.43.252","10.0.5.220","TCP","1514","443  >  46042 [ACK] Seq=2897 Ack=518 Win=28160 Len=1448 TSval=3340280150 TSecr=48530504 [TCP PDU reassembled in 135]"
"135","2.264449","18.211.43.252","10.0.5.220","TLSv1.2","1311","Certificate, Server Key Exchange, Server Hello Done"
"136","2.265336","52.4.140.83","10.0.5.220","TLSv1.2","117","Change Cipher Spec, Encrypted Handshake Message"
"137","2.268503","52.72.179.74","10.0.5.220","TLSv1.2","117","Change Cipher Spec, Encrypted Handshake Message"
"138","2.269646","3.93.209.69","10.0.5.220","TLSv1.2","117","Change Cipher Spec, Encrypted Handshake Message"
"139","2.279237","10.0.5.220","3.93.209.69","TCP","78","[TCP Dup ACK 95#1] 39199  >  443 [ACK] Seq=518 Ack=1 Win=90624 Len=0 TSval=48530565 TSecr=3892433673 SLE=1449 SRE=2897"
"140","2.279417","10.0.5.220","3.93.209.69","TCP","78","[TCP Dup ACK 95#2] 39199  >  443 [ACK] Seq=518 Ack=1 Win=91904 Len=0 TSval=48530565 TSecr=3892433673 SLE=1449 SRE=3566"
"141","2.279657","10.0.5.220","18.211.43.252","TCP","66","46043  >  443 [ACK] Seq=518 Ack=1449 Win=90624 Len=0 TSval=48530565 TSecr=3340280003"
"142","2.279722","10.0.5.220","18.211.43.252","TCP","66","46043  >  443 [ACK] Seq=518 Ack=2897 Win=93440 Len=0 TSval=48530565 TSecr=3340280003"
"143","2.279725","10.0.5.220","18.211.43.252","TCP","66","46043  >  443 [ACK] Seq=518 Ack=4345 Win=96512 Len=0 TSval=48530565 TSecr=3340280003"
"144","2.280036","10.0.5.220","18.211.43.252","TCP","66","46043  >  443 [ACK] Seq=518 Ack=5590 Win=99328 Len=0 TSval=48530565 TSecr=3340280004"
"145","2.280096","10.0.5.220","3.93.209.69","TCP","78","[TCP Dup ACK 122#1] 39195  >  443 [ACK] Seq=644 Ack=3566 Win=96512 Len=0 TSval=48530565 TSecr=3892433694 SLE=2897 SRE=3566"
"146","2.287890","10.0.5.220","52.72.179.74","TCP","78","[TCP Dup ACK 125#1] 43360  >  443 [ACK] Seq=644 Ack=3566 Win=96512 Len=0 TSval=48530565 TSecr=2718994266 SLE=2897 SRE=3566"
"147","2.291561","10.0.5.220","255.255.255.255","UDP","543","44318  >  20002 Len=501"
"148","2.294496","10.0.5.220","18.211.43.252","TLSv1.2","192","Client Key Exchange, Change Cipher Spec, Encrypted Handshake Message"
"149","2.296254","10.0.5.220","52.72.179.74","TLSv1.2","816","Application Data"
"150","2.296500","10.0.5.220","18.211.43.252","TCP","66","46042  >  443 [ACK] Seq=518 Ack=1449 Win=90624 Len=0 TSval=48530567 TSecr=3340280150"
"151","2.296560","10.0.5.220","18.211.43.252","TCP","66","46042  >  443 [ACK] Seq=518 Ack=2897 Win=93440 Len=0 TSval=48530570 TSecr=3340280150"
"152","2.296639","10.0.5.220","18.211.43.252","TCP","66","46042  >  443 [ACK] Seq=518 Ack=4345 Win=96512 Len=0 TSval=48530570 TSecr=3340280150"
"153","2.296715","10.0.5.220","18.211.43.252","TCP","66","46042  >  443 [ACK] Seq=518 Ack=5590 Win=99328 Len=0 TSval=48530570 TSecr=3340280151"
"154","2.296879","10.0.5.220","52.72.179.74","TCP","66","43360  >  443 [ACK] Seq=644 Ack=3617 Win=96512 Len=0 TSval=48530570 TSecr=2718994395"
"155","2.297040","10.0.5.220","3.93.209.69","TCP","66","39195  >  443 [ACK] Seq=644 Ack=3617 Win=96512 Len=0 TSval=48530570 TSecr=3892433827"
"156","2.297276","10.0.5.220","52.4.140.83","TCP","1514","40144  >  443 [PSH, ACK] Seq=644 Ack=3475 Win=96512 Len=1448 TSval=48530570 TSecr=2094979354 [TCP PDU reassembled in 157]"
"157","2.297666","10.0.5.220","52.4.140.83","TLSv1.2","1454","Application Data"
"158","2.300320","10.0.5.220","18.211.43.252","TLSv1.2","192","Client Key Exchange, Change Cipher Spec, Encrypted Handshake Message"
"159","2.300383","10.0.5.220","52.72.179.74","TLSv1.2","589","Application Data"
"160","2.305284","10.0.5.220","3.93.209.69","TLSv1.2","591","Application Data"
"161","2.321408","18.211.43.252","10.0.5.220","TLSv1.2","237","New Session Ticket, Change Cipher Spec, Encrypted Handshake Message"
"162","2.321430","18.211.43.252","10.0.5.220","TCP","66","443  >  46043 [ACK] Seq=5590 Ack=644 Win=28160 Len=0 TSval=3340280208 TSecr=48530566"
"163","2.323951","52.4.140.83","10.0.5.220","TCP","66","443  >  40144 [ACK] Seq=3475 Ack=3480 Win=48896 Len=0 TSval=2094979413 TSecr=48530570"
"164","2.325660","10.0.5.220","18.211.43.252","TLSv1.2","1032","Application Data"
"165","2.325841","18.211.43.252","10.0.5.220","TLSv1.2","237","New Session Ticket, Change Cipher Spec, Encrypted Handshake Message"
"166","2.325859","18.211.43.252","10.0.5.220","TCP","66","443  >  46042 [ACK] Seq=5590 Ack=644 Win=28160 Len=0 TSval=3340280212 TSecr=48530571"
"167","2.329236","52.4.140.83","10.0.5.220","TLSv1.2","332","Application Data"
"168","2.340858","3.93.209.69","10.0.5.220","TCP","1514","[TCP Retransmission] 443  >  39199 [ACK] Seq=1 Ack=518 Win=30464 Len=1448 TSval=3892433898 TSecr=48530565"
"169","2.353480","52.72.179.74","10.0.5.220","TLSv1.2","303","Application Data"
"170","2.362856","18.211.43.252","10.0.5.220","TLSv1.2","753","Application Data"
"171","2.362877","18.211.43.252","10.0.5.220","TLSv1.2","100","Application Data"
"172","2.363766","52.72.179.74","10.0.5.220","TCP","66","443  >  43364 [ACK] Seq=3617 Ack=1394 Win=32000 Len=0 TSval=2718994490 TSecr=48530566"
"173","2.368786","3.93.209.69","10.0.5.220","TCP","66","443  >  39195 [ACK] Seq=3617 Ack=1169 Win=29184 Len=0 TSval=3892433926 TSecr=48530571"
"174","2.379018","3.93.209.69","10.0.5.220","TLSv1.2","390","Application Data"
"175","2.409783","52.72.179.74","10.0.5.220","TLSv1.2","1049","Application Data"
"176","2.477612","10.0.5.220","52.4.140.83","TCP","1454","[TCP Spurious Retransmission] 40144  >  443 [PSH, ACK] Seq=2092 Ack=3475 Win=96512 Len=1388 TSval=48530608 TSecr=2094979354 [TCP PDU reassembled in 157]"
"177","2.504290","52.4.140.83","10.0.5.220","TCP","78","[TCP Dup ACK 163#1] 443  >  40144 [ACK] Seq=3741 Ack=3480 Win=48896 Len=0 TSval=2094979593 TSecr=48530608 SLE=2092 SRE=3480"
"178","2.521867","10.0.5.220","18.211.43.252","TLSv1.2","1468","Application Data"
"179","2.525229","10.0.5.220","52.72.179.74","TLSv1.2","596","Application Data"
"180","2.525295","10.0.5.220","52.72.179.74","TLSv1.2","612","Application Data"
"181","2.525377","10.0.5.220","3.93.209.69","TLSv1.2","600","Application Data"
"182","2.547336","10.0.5.220","18.211.43.252","TCP","66","46043  >  443 [ACK] Seq=1610 Ack=6448 Win=105216 Len=0 TSval=48530648 TSecr=3340280249"
"183","2.549307","3.93.209.69","10.0.5.220","TCP","66","443  >  39195 [ACK] Seq=3941 Ack=1703 Win=30208 Len=0 TSval=3892434107 TSecr=48530639"
"184","2.550395","10.0.5.220","52.4.140.83","TCP","66","40144  >  443 [ACK] Seq=3480 Ack=3741 Win=99328 Len=0 TSval=48530648 TSecr=2094979418"
"185","2.551113","52.72.179.74","10.0.5.220","TCP","66","443  >  43364 [ACK] Seq=4600 Ack=1940 Win=33280 Len=0 TSval=2718994677 TSecr=48530638"
"186","2.561279","52.72.179.74","10.0.5.220","TLSv1.2","275","Application Data"
"187","2.570944","52.72.179.74","10.0.5.220","TLSv1.2","481","Application Data"
"188","2.588743","18.211.43.252","10.0.5.220","TCP","66","443  >  46042 [ACK] Seq=5761 Ack=2046 Win=30976 Len=0 TSval=3340280475 TSecr=48530636"
"189","2.612561","3.93.209.69","10.0.5.220","TLSv1.2","260","Application Data"
"190","2.713290","10.0.5.220","255.255.255.255","UDP","543","44318  >  20002 Len=501"
"191","2.722858","18.211.43.252","10.0.5.220","TLSv1.2","1117","Application Data"
"192","2.722885","18.211.43.252","10.0.5.220","TLSv1.2","100","Application Data"
"193","2.727642","10.0.5.220","18.211.43.252","TCP","66","46042  >  443 [ACK] Seq=2046 Ack=6846 Win=105216 Len=0 TSval=48530701 TSecr=3340280609"
"194","2.736869","3.93.209.69","10.0.5.220","TCP","1514","[TCP Retransmission] 443  >  39199 [ACK] Seq=1 Ack=518 Win=30464 Len=1448 TSval=3892434294 TSecr=48530565"
"195","2.741785","10.0.5.220","3.93.209.69","TCP","66","39199  >  443 [ACK] Seq=518 Ack=3566 Win=94976 Len=0 TSval=48530706 TSecr=3892434294"
"196","2.749645","10.0.5.220","3.93.209.69","TLSv1.2","192","Client Key Exchange, Change Cipher Spec, Encrypted Handshake Message"
"197","2.762238","10.0.5.220","3.93.209.69","TCP","66","39195  >  443 [ACK] Seq=1703 Ack=4135 Win=102144 Len=0 TSval=48530710 TSecr=3892434170"
"198","2.762389","10.0.5.220","52.72.179.74","TCP","66","43364  >  443 [ACK] Seq=1940 Ack=5015 Win=102144 Len=0 TSval=48530710 TSecr=2718994697"
"199","2.765526","10.0.5.220","52.72.179.74","TCP","66","43360  >  443 [ACK] Seq=1697 Ack=4063 Win=102144 Len=0 TSval=48530710 TSecr=2718994688"
"200","2.775522","3.93.209.69","10.0.5.220","TLSv1.2","117","Change Cipher Spec, Encrypted Handshake Message"
"201","2.780400","10.0.5.220","3.93.209.69","TLSv1.2","589","Application Data"
"202","2.816510","3.93.209.69","10.0.5.220","TLSv1.2","302","Application Data"
"203","2.952235","10.0.5.220","255.255.255.255","UDP","543","44318  >  20002 Len=501"
"204","2.962873","10.0.5.220","52.72.179.74","TLSv1.2","599","Application Data"
"205","2.983565","10.0.5.220","255.255.255.255","TPLINK-SMARTHOME/JSON","189","UDP Cmd: {""system"":{""get_sysinfo"":{}},""cnCloud"":{""get_info"":{}},""smartlife.iot.common.cloud"":{""get_info"":{}},""smartlife.cam.ipcamera.cloud"":{""get_info"":{}}}"
"206","2.997330","52.72.179.74","10.0.5.220","TLSv1.2","302","Application Data"
"207","3.002288","10.0.5.220","224.0.0.251","MDNS","46","Server status request 0x0aba[Malformed Packet]"
"208","3.002442","10.0.5.220","10.0.5.86","TCP","74","[TCP Retransmission] 38900  >  9999 [SYN] Seq=0 Win=65535 Len=0 MSS=1460 SACK_PERM TSval=48530784 TSecr=0 WS=256"
"209","3.002539","10.0.5.220","52.72.179.74","TCP","66","43364  >  443 [ACK] Seq=2473 Ack=5251 Win=105216 Len=0 TSval=48530784 TSecr=2718995124"
"210","3.009454","10.0.5.220","3.93.209.69","TCP","66","39199  >  443 [ACK] Seq=1167 Ack=3853 Win=97792 Len=0 TSval=48530787 TSecr=3892434374"
"211","3.032660","18.211.43.252","10.0.5.220","TCP","100","[TCP Retransmission] 443  >  46043 [PSH, ACK] Seq=6448 Ack=1610 Win=29952 Len=34 TSval=3340280919 TSecr=48530648"
"212","3.035386","10.0.5.220","18.211.43.252","TCP","66","46043  >  443 [ACK] Seq=1610 Ack=6482 Win=105216 Len=0 TSval=48530794 TSecr=3340280919"
"213","3.179007","10.0.5.220","255.255.255.255","UDP","543","44318  >  20002 Len=501"
"214","3.563734","10.0.5.220","255.255.255.255","UDP","543","44318  >  20002 Len=501"
"215","3.788381","10.0.5.220","255.255.255.255","UDP","543","44318  >  20002 Len=501"
"216","3.998572","10.0.5.220","255.255.255.255","TPLINK-SMARTHOME/JSON","189","UDP Cmd: {""system"":{""get_sysinfo"":{}},""cnCloud"":{""get_info"":{}},""smartlife.iot.common.cloud"":{""get_info"":{}},""smartlife.cam.ipcamera.cloud"":{""get_info"":{}}}"
"217","4.001645","10.0.5.220","224.0.0.251","MDNS","46","Server status request 0x0aba[Malformed Packet]"
"218","4.075300","10.0.5.220","255.255.255.255","UDP","543","44318  >  20002 Len=501"
"219","5.018805","36:cd:80:d9:58:3d","TPLink_e6:03:cd","ARP","42","Who has 10.0.5.86? Tell 10.0.5.220"
"220","5.069730","RaspberryPiF_59:60:d1","36:cd:80:d9:58:3d","ARP","42","Who has 10.0.5.220? Tell 10.0.5.1"
"221","5.072152","36:cd:80:d9:58:3d","RaspberryPiF_59:60:d1","ARP","42","10.0.5.220 is at 36:cd:80:d9:58:3d"
"222","5.768484","36:cd:80:d9:58:3d","TPLink_e6:03:cd","ARP","42","Who has 10.0.5.86? Tell 10.0.5.220"
"223","6.526408","36:cd:80:d9:58:3d","TPLink_e6:03:cd","ARP","42","Who has 10.0.5.86? Tell 10.0.5.220"
"224","7.030062","10.0.5.220","10.0.5.86","TCP","74","[TCP Retransmission] 38900  >  9999 [SYN] Seq=0 Win=65535 Len=0 MSS=1460 SACK_PERM TSval=48531988 TSecr=0 WS=256"
"225","7.267672","36:cd:80:d9:58:3d","TPLink_e6:03:cd","ARP","42","Who has 10.0.5.86? Tell 10.0.5.220"
"226","8.019726","36:cd:80:d9:58:3d","TPLink_e6:03:cd","ARP","42","Who has 10.0.5.86? Tell 10.0.5.220"
"227","8.764958","36:cd:80:d9:58:3d","TPLink_e6:03:cd","ARP","42","Who has 10.0.5.86? Tell 10.0.5.220"
"228","9.516481","36:cd:80:d9:58:3d","TPLink_e6:03:cd","ARP","42","Who has 10.0.5.86? Tell 10.0.5.220"
"229","9.787208","10.0.5.220","10.0.5.1","DNS","94","Standard query 0x370e A use1-app-tapo-care.i.tplinknbu.com"
"230","9.795725","10.0.5.1","10.0.5.220","DNS","142","Standard query response 0x370e A use1-app-tapo-care.i.tplinknbu.com A 52.54.238.225 A 3.93.209.69 A 52.72.179.74"
"231","9.813691","10.0.5.220","52.54.238.225","TCP","74","37404  >  443 [SYN] Seq=0 Win=65535 Len=0 MSS=1460 SACK_PERM TSval=48532828 TSecr=0 WS=256"
"232","9.836981","52.54.238.225","10.0.5.220","TCP","74","443  >  37404 [SYN, ACK] Seq=0 Ack=1 Win=26847 Len=0 MSS=1460 SACK_PERM TSval=2528435267 TSecr=48532828 WS=256"
"233","9.838906","10.0.5.220","52.54.238.225","TCP","66","37404  >  443 [ACK] Seq=1 Ack=1 Win=87808 Len=0 TSval=48532835 TSecr=2528435267"
"234","9.840754","10.0.5.220","52.54.238.225","TLSv1.2","583","Client Hello (SNI=use1-app-tapo-care.i.tplinknbu.com)"
"235","9.864057","52.54.238.225","10.0.5.220","TCP","66","443  >  37404 [ACK] Seq=1 Ack=518 Win=30464 Len=0 TSval=2528435315 TSecr=48532836"
"236","9.865090","52.54.238.225","10.0.5.220","TLSv1.2","1514","Server Hello"
"237","9.865110","52.54.238.225","10.0.5.220","TCP","1514","443  >  37404 [ACK] Seq=1449 Ack=518 Win=30464 Len=1448 TSval=2528435315 TSecr=48532836 [TCP PDU reassembled in 238]"
"238","9.865119","52.54.238.225","10.0.5.220","TLSv1.2","735","Certificate, Server Key Exchange, Server Hello Done"
"239","9.870560","10.0.5.220","52.54.238.225","TCP","66","37404  >  443 [ACK] Seq=518 Ack=1449 Win=90624 Len=0 TSval=48532844 TSecr=2528435315"
"240","9.870712","10.0.5.220","52.54.238.225","TCP","66","37404  >  443 [ACK] Seq=518 Ack=2897 Win=93440 Len=0 TSval=48532844 TSecr=2528435315"
"241","9.870876","10.0.5.220","52.54.238.225","TCP","66","37404  >  443 [ACK] Seq=518 Ack=3566 Win=96512 Len=0 TSval=48532844 TSecr=2528435315"
"242","9.901785","10.0.5.220","52.54.238.225","TLSv1.2","192","Client Key Exchange, Change Cipher Spec, Encrypted Handshake Message"
"243","9.924309","52.54.238.225","10.0.5.220","TLSv1.2","117","Change Cipher Spec, Encrypted Handshake Message"
"244","9.926850","10.0.5.220","52.54.238.225","TLSv1.2","578","Application Data"
"245","9.974280","52.54.238.225","10.0.5.220","TLSv1.2","629","Application Data"
"246","10.004709","10.0.5.220","10.0.5.1","DNS","86","Standard query 0x5a05 A n-use1-wap.tplinkcloud.com"
"247","10.012469","10.0.5.1","10.0.5.220","DNS","118","Standard query response 0x5a05 A n-use1-wap.tplinkcloud.com A 52.4.140.83 A 52.22.73.179"
"248","10.014317","10.0.5.220","52.4.140.83","TCP","74","40160  >  443 [SYN] Seq=0 Win=65535 Len=0 MSS=1460 SACK_PERM TSval=48532888 TSecr=0 WS=256"
"249","10.038208","52.4.140.83","10.0.5.220","TCP","74","443  >  40160 [SYN, ACK] Seq=0 Ack=1 Win=26847 Len=0 MSS=1460 SACK_PERM TSval=2094987127 TSecr=48532888 WS=256"
"250","10.039269","10.0.5.220","52.4.140.83","TCP","66","40160  >  443 [ACK] Seq=1 Ack=1 Win=87808 Len=0 TSval=48532895 TSecr=2094987127"
"251","10.039595","10.0.5.220","52.54.238.225","TCP","66","37404  >  443 [ACK] Seq=1156 Ack=4180 Win=99328 Len=0 TSval=48532896 TSecr=2528435425"
"252","10.040774","10.0.5.220","52.4.140.83","TLSv1.2","583","Client Hello (SNI=n-use1-wap.tplinkcloud.com)"
"253","10.065256","52.4.140.83","10.0.5.220","TCP","66","443  >  40160 [ACK] Seq=1 Ack=518 Win=28160 Len=0 TSval=2094987154 TSecr=48532896"
"254","10.066091","52.4.140.83","10.0.5.220","TLSv1.2","1514","Server Hello"
"255","10.066111","52.4.140.83","10.0.5.220","TCP","1514","443  >  40160 [ACK] Seq=1449 Ack=518 Win=28160 Len=1448 TSval=2094987155 TSecr=48532896 [TCP PDU reassembled in 256]"
"256","10.066121","52.4.140.83","10.0.5.220","TLSv1.2","593","Certificate, Server Key Exchange, Server Hello Done"
"257","10.092019","10.0.5.220","52.4.140.83","TCP","66","40160  >  443 [ACK] Seq=518 Ack=1449 Win=90624 Len=0 TSval=48532911 TSecr=2094987155"
"258","10.092171","10.0.5.220","52.4.140.83","TCP","66","40160  >  443 [ACK] Seq=518 Ack=2897 Win=93440 Len=0 TSval=48532911 TSecr=2094987155"
"259","10.092317","10.0.5.220","52.4.140.83","TCP","66","40160  >  443 [ACK] Seq=518 Ack=3424 Win=96512 Len=0 TSval=48532911 TSecr=2094987155"
"260","10.094046","10.0.5.220","52.4.140.83","TLSv1.2","192","Client Key Exchange, Change Cipher Spec, Encrypted Handshake Message"
"261","10.118111","52.4.140.83","10.0.5.220","TLSv1.2","117","Change Cipher Spec, Encrypted Handshake Message"
"262","10.123240","10.0.5.220","52.4.140.83","TLSv1.2","977","Application Data"
"263","10.153365","52.4.140.83","10.0.5.220","TLSv1.2","286","Application Data"
"264","10.180524","10.0.5.220","10.0.5.86","TCP","74","38922  >  9999 [SYN] Seq=0 Win=65535 Len=0 MSS=1460 SACK_PERM TSval=48532938 TSecr=0 WS=256"
"265","10.216247","10.0.5.220","52.4.140.83","TCP","66","40160  >  443 [ACK] Seq=1555 Ack=3695 Win=99328 Len=0 TSval=48532949 TSecr=2094987242"
"266","10.250573","36:cd:80:d9:58:3d","TPLink_e6:03:cd","ARP","42","Who has 10.0.5.86? Tell 10.0.5.220"
"267","11.018327","36:cd:80:d9:58:3d","TPLink_e6:03:cd","ARP","42","Who has 10.0.5.86? Tell 10.0.5.220"
"268","11.203140","10.0.5.220","10.0.5.86","TCP","74","[TCP Retransmission] 38922  >  9999 [SYN] Seq=0 Win=65535 Len=0 MSS=1460 SACK_PERM TSval=48533239 TSecr=0 WS=256"
"269","11.765584","36:cd:80:d9:58:3d","TPLink_e6:03:cd","ARP","42","Who has 10.0.5.86? Tell 10.0.5.220"
"270","13.200339","36:cd:80:d9:58:3d","Broadcast","ARP","42","Who has 10.0.5.86? Tell 10.0.5.220"
"271","13.987812","36:cd:80:d9:58:3d","Broadcast","ARP","42","Who has 10.0.5.86? Tell 10.0.5.220"
"272","14.704018","36:cd:80:d9:58:3d","Broadcast","ARP","42","Who has 10.0.5.86? Tell 10.0.5.220"
"273","14.982275","10.0.5.220","18.211.43.252","TLSv1.2","288","Application Data"
"274","15.007829","18.211.43.252","10.0.5.220","TCP","66","443  >  46042 [ACK] Seq=6846 Ack=2268 Win=33536 Len=0 TSval=3340292894 TSecr=48534378"
"275","15.009173","18.211.43.252","10.0.5.220","TLSv1.2","546","Application Data"
"276","15.009198","18.211.43.252","10.0.5.220","TLSv1.2","100","Application Data"
"277","15.011321","10.0.5.220","18.211.43.252","TCP","66","46042  >  443 [ACK] Seq=2268 Ack=7360 Win=108032 Len=0 TSval=48534387 TSecr=3340292896"
"278","15.451331","36:cd:80:d9:58:3d","Broadcast","ARP","42","Who has 10.0.5.86? Tell 10.0.5.220"
"279","15.455962","10.0.5.220","52.4.140.83","TLSv1.2","1014","Application Data"
"280","15.484654","52.4.140.83","10.0.5.220","TLSv1.2","286","Application Data"
"281","15.492968","10.0.5.220","52.4.140.83","TCP","66","40160  >  443 [ACK] Seq=2503 Ack=3915 Win=102144 Len=0 TSval=48534530 TSecr=2094992573"
"282","15.495618","10.0.5.220","52.4.140.83","TLSv1.2","992","Application Data"
"283","15.524756","52.4.140.83","10.0.5.220","TLSv1.2","286","Application Data"
"284","15.564588","10.0.5.220","52.4.140.83","TLSv1.2","898","Application Data"
"285","15.632496","52.4.140.83","10.0.5.220","TCP","66","443  >  40160 [ACK] Seq=4135 Ack=4261 Win=51456 Len=0 TSval=2094992721 TSecr=48534552"
"286","15.921522","52.4.140.83","10.0.5.220","TLSv1.2","255","Application Data"
"287","16.072799","10.0.5.220","18.211.43.252","TLSv1.2","1039","Application Data"
"288","16.074229","10.0.5.220","18.211.43.252","TLSv1.2","1100","Application Data"
"289","16.074297","10.0.5.220","18.211.43.252","TCP","74","46052  >  443 [SYN] Seq=0 Win=65535 Len=0 MSS=1460 SACK_PERM TSval=48534706 TSecr=0 WS=256"
"290","16.076087","10.0.5.220","52.4.140.83","TCP","66","40160  >  443 [ACK] Seq=4261 Ack=4324 Win=108032 Len=0 TSval=48534707 TSecr=2094993010"
"291","16.099781","18.211.43.252","10.0.5.220","TCP","74","443  >  46052 [SYN, ACK] Seq=0 Ack=1 Win=26847 Len=0 MSS=1460 SACK_PERM TSval=3340293986 TSecr=48534706 WS=256"
"292","16.108286","18.211.43.252","10.0.5.220","TLSv1.2","583","Application Data"
"293","16.108309","18.211.43.252","10.0.5.220","TLSv1.2","100","Application Data"
"294","16.108378","10.0.5.220","18.211.43.252","TCP","66","46052  >  443 [ACK] Seq=1 Ack=1 Win=87808 Len=0 TSval=48534715 TSecr=3340293986"
"295","16.110017","10.0.5.220","18.211.43.252","TLSv1.2","583","Client Hello (SNI=api.tplinkra.com)"
"296","16.110081","10.0.5.220","18.211.43.252","TCP","66","46043  >  443 [ACK] Seq=2583 Ack=6999 Win=108032 Len=0 TSval=48534717 TSecr=3340293995"
"297","16.110250","10.0.5.220","18.211.43.252","TCP","66","46043  >  443 [ACK] Seq=2583 Ack=7033 Win=108032 Len=0 TSval=48534717 TSecr=3340293995"
"298","16.113956","18.211.43.252","10.0.5.220","TLSv1.2","628","Application Data"
"299","16.113981","18.211.43.252","10.0.5.220","TLSv1.2","100","Application Data"
"300","16.115693","10.0.5.220","18.211.43.252","TCP","66","46042  >  443 [ACK] Seq=3302 Ack=7956 Win=110848 Len=0 TSval=48534718 TSecr=3340294001"
"301","16.133696","18.211.43.252","10.0.5.220","TCP","66","443  >  46052 [ACK] Seq=1 Ack=518 Win=28160 Len=0 TSval=3340294020 TSecr=48534715"
"302","16.133750","18.211.43.252","10.0.5.220","TLSv1.2","1514","Server Hello"
"303","16.133760","18.211.43.252","10.0.5.220","TCP","1514","443  >  46052 [ACK] Seq=1449 Ack=518 Win=28160 Len=1448 TSval=3340294020 TSecr=48534715 [TCP PDU reassembled in 305]"
"304","16.133769","18.211.43.252","10.0.5.220","TCP","1514","443  >  46052 [ACK] Seq=2897 Ack=518 Win=28160 Len=1448 TSval=3340294020 TSecr=48534715 [TCP PDU reassembled in 305]"
"305","16.134406","18.211.43.252","10.0.5.220","TLSv1.2","1311","Certificate, Server Key Exchange, Server Hello Done"
"306","16.135351","10.0.5.220","18.211.43.252","TCP","66","46052  >  443 [ACK] Seq=518 Ack=1449 Win=90624 Len=0 TSval=48534724 TSecr=3340294020"
"307","16.136067","10.0.5.220","18.211.43.252","TCP","66","46052  >  443 [ACK] Seq=518 Ack=2897 Win=93440 Len=0 TSval=48534724 TSecr=3340294020"
"308","16.136393","10.0.5.220","18.211.43.252","TCP","66","46052  >  443 [ACK] Seq=518 Ack=4345 Win=96512 Len=0 TSval=48534725 TSecr=3340294020"
"309","16.136715","10.0.5.220","18.211.43.252","TCP","66","46052  >  443 [ACK] Seq=518 Ack=5590 Win=99328 Len=0 TSval=48534725 TSecr=3340294021"
"310","16.141336","10.0.5.220","18.211.43.252","TLSv1.2","192","Client Key Exchange, Change Cipher Spec, Encrypted Handshake Message"
"311","16.165650","18.211.43.252","10.0.5.220","TLSv1.2","237","New Session Ticket, Change Cipher Spec, Encrypted Handshake Message"
"312","16.165675","18.211.43.252","10.0.5.220","TCP","66","443  >  46052 [ACK] Seq=5590 Ack=644 Win=28160 Len=0 TSval=3340294052 TSecr=48534726"
"313","16.168637","10.0.5.220","18.211.43.252","TLSv1.2","1052","Application Data"
"314","16.187299","36:cd:80:d9:58:3d","Broadcast","ARP","42","Who has 10.0.5.86? Tell 10.0.5.220"
"315","16.207564","18.211.43.252","10.0.5.220","TLSv1.2","595","Application Data"
"316","16.207590","18.211.43.252","10.0.5.220","TLSv1.2","100","Application Data"
"317","16.213071","10.0.5.220","18.211.43.252","TCP","66","46052  >  443 [ACK] Seq=1630 Ack=6324 Win=105216 Len=0 TSval=48534748 TSecr=3340294094"
"318","16.951259","36:cd:80:d9:58:3d","Broadcast","ARP","42","Who has 10.0.5.86? Tell 10.0.5.220"
